+ 0 /NodeList/0/DeviceList/2/$ns3::PointToPointNetDevice/TxQueue/Enqueue ns3::PppHeader (Point-to-Point Protocol: IP (0x0021)) ns3::Ipv4Header (tos 0x0 DSCP Default ECN Not-ECT ttl 64 id 0 protocol 6 offset (bytes) 0 flags [none] length: 56 10.1.3.4 > 10.1.8.1) ns3::TcpHeader (49153 > 999 [SYN] Seq=0 Ack=0 Win=2048 ns3::TcpOptionWinScale(0) ns3::TcpOptionMpTcpCapable(MP_CAPABLE: flags=1] Sender's Key :[384]) ns3::TcpOptionEnd(EOL))
- 0 /NodeList/0/DeviceList/2/$ns3::PointToPointNetDevice/TxQueue/Dequeue ns3::PppHeader (Point-to-Point Protocol: IP (0x0021)) ns3::Ipv4Header (tos 0x0 DSCP Default ECN Not-ECT ttl 64 id 0 protocol 6 offset (bytes) 0 flags [none] length: 56 10.1.3.4 > 10.1.8.1) ns3::TcpHeader (49153 > 999 [SYN] Seq=0 Ack=0 Win=2048 ns3::TcpOptionWinScale(0) ns3::TcpOptionMpTcpCapable(MP_CAPABLE: flags=1] Sender's Key :[384]) ns3::TcpOptionEnd(EOL))
r 2.33e-07 /NodeList/2/DeviceList/5/$ns3::PointToPointNetDevice/MacRx ns3::PppHeader (Point-to-Point Protocol: IP (0x0021)) ns3::Ipv4Header (tos 0x0 DSCP Default ECN Not-ECT ttl 64 id 0 protocol 6 offset (bytes) 0 flags [none] length: 56 10.1.3.4 > 10.1.8.1) ns3::TcpHeader (49153 > 999 [SYN] Seq=0 Ack=0 Win=2048 ns3::TcpOptionWinScale(0) ns3::TcpOptionMpTcpCapable(MP_CAPABLE: flags=1] Sender's Key :[384]) ns3::TcpOptionEnd(EOL))
+ 2.33e-07 /NodeList/2/DeviceList/3/$ns3::PointToPointNetDevice/TxQueue/Enqueue ns3::PppHeader (Point-to-Point Protocol: IP (0x0021)) ns3::Ipv4Header (tos 0x0 DSCP Default ECN Not-ECT ttl 63 id 0 protocol 6 offset (bytes) 0 flags [none] length: 56 10.1.3.4 > 10.1.8.1) ns3::TcpHeader (49153 > 999 [SYN] Seq=0 Ack=0 Win=2048 ns3::TcpOptionWinScale(0) ns3::TcpOptionMpTcpCapable(MP_CAPABLE: flags=1] Sender's Key :[384]) ns3::TcpOptionEnd(EOL))
- 2.33e-07 /NodeList/2/DeviceList/3/$ns3::PointToPointNetDevice/TxQueue/Dequeue ns3::PppHeader (Point-to-Point Protocol: IP (0x0021)) ns3::Ipv4Header (tos 0x0 DSCP Default ECN Not-ECT ttl 63 id 0 protocol 6 offset (bytes) 0 flags [none] length: 56 10.1.3.4 > 10.1.8.1) ns3::TcpHeader (49153 > 999 [SYN] Seq=0 Ack=0 Win=2048 ns3::TcpOptionWinScale(0) ns3::TcpOptionMpTcpCapable(MP_CAPABLE: flags=1] Sender's Key :[384]) ns3::TcpOptionEnd(EOL))
r 0.000232234 /NodeList/4/DeviceList/2/$ns3::PointToPointNetDevice/MacRx ns3::PppHeader (Point-to-Point Protocol: IP (0x0021)) ns3::Ipv4Header (tos 0x0 DSCP Default ECN Not-ECT ttl 63 id 0 protocol 6 offset (bytes) 0 flags [none] length: 56 10.1.3.4 > 10.1.8.1) ns3::TcpHeader (49153 > 999 [SYN] Seq=0 Ack=0 Win=2048 ns3::TcpOptionWinScale(0) ns3::TcpOptionMpTcpCapable(MP_CAPABLE: flags=1] Sender's Key :[384]) ns3::TcpOptionEnd(EOL))
+ 0.000232234 /NodeList/4/DeviceList/3/$ns3::PointToPointNetDevice/TxQueue/Enqueue ns3::PppHeader (Point-to-Point Protocol: IP (0x0021)) ns3::Ipv4Header (tos 0x0 DSCP Default ECN Not-ECT ttl 62 id 0 protocol 6 offset (bytes) 0 flags [none] length: 56 10.1.3.4 > 10.1.8.1) ns3::TcpHeader (49153 > 999 [SYN] Seq=0 Ack=0 Win=2048 ns3::TcpOptionWinScale(0) ns3::TcpOptionMpTcpCapable(MP_CAPABLE: flags=1] Sender's Key :[384]) ns3::TcpOptionEnd(EOL))
- 0.000232234 /NodeList/4/DeviceList/3/$ns3::PointToPointNetDevice/TxQueue/Dequeue ns3::PppHeader (Point-to-Point Protocol: IP (0x0021)) ns3::Ipv4Header (tos 0x0 DSCP Default ECN Not-ECT ttl 62 id 0 protocol 6 offset (bytes) 0 flags [none] length: 56 10.1.3.4 > 10.1.8.1) ns3::TcpHeader (49153 > 999 [SYN] Seq=0 Ack=0 Win=2048 ns3::TcpOptionWinScale(0) ns3::TcpOptionMpTcpCapable(MP_CAPABLE: flags=1] Sender's Key :[384]) ns3::TcpOptionEnd(EOL))
r 0.000232467 /NodeList/1/DeviceList/3/$ns3::PointToPointNetDevice/MacRx ns3::PppHeader (Point-to-Point Protocol: IP (0x0021)) ns3::Ipv4Header (tos 0x0 DSCP Default ECN Not-ECT ttl 62 id 0 protocol 6 offset (bytes) 0 flags [none] length: 56 10.1.3.4 > 10.1.8.1) ns3::TcpHeader (49153 > 999 [SYN] Seq=0 Ack=0 Win=2048 ns3::TcpOptionWinScale(0) ns3::TcpOptionMpTcpCapable(MP_CAPABLE: flags=1] Sender's Key :[384]) ns3::TcpOptionEnd(EOL))
+ 0.000232467 /NodeList/1/DeviceList/3/$ns3::PointToPointNetDevice/TxQueue/Enqueue ns3::PppHeader (Point-to-Point Protocol: IP (0x0021)) ns3::Ipv4Header (tos 0x0 DSCP Default ECN Not-ECT ttl 64 id 0 protocol 6 offset (bytes) 0 flags [none] length: 56 10.1.8.1 > 10.1.3.4) ns3::TcpHeader (999 > 49153 [SYN|ACK] Seq=0 Ack=1 Win=2048 ns3::TcpOptionWinScale(0) ns3::TcpOptionMpTcpCapable(MP_CAPABLE: flags=1] Sender's Key :[887]) ns3::TcpOptionEnd(EOL))
- 0.000232467 /NodeList/1/DeviceList/3/$ns3::PointToPointNetDevice/TxQueue/Dequeue ns3::PppHeader (Point-to-Point Protocol: IP (0x0021)) ns3::Ipv4Header (tos 0x0 DSCP Default ECN Not-ECT ttl 64 id 0 protocol 6 offset (bytes) 0 flags [none] length: 56 10.1.8.1 > 10.1.3.4) ns3::TcpHeader (999 > 49153 [SYN|ACK] Seq=0 Ack=1 Win=2048 ns3::TcpOptionWinScale(0) ns3::TcpOptionMpTcpCapable(MP_CAPABLE: flags=1] Sender's Key :[887]) ns3::TcpOptionEnd(EOL))
r 0.0002327 /NodeList/4/DeviceList/3/$ns3::PointToPointNetDevice/MacRx ns3::PppHeader (Point-to-Point Protocol: IP (0x0021)) ns3::Ipv4Header (tos 0x0 DSCP Default ECN Not-ECT ttl 64 id 0 protocol 6 offset (bytes) 0 flags [none] length: 56 10.1.8.1 > 10.1.3.4) ns3::TcpHeader (999 > 49153 [SYN|ACK] Seq=0 Ack=1 Win=2048 ns3::TcpOptionWinScale(0) ns3::TcpOptionMpTcpCapable(MP_CAPABLE: flags=1] Sender's Key :[887]) ns3::TcpOptionEnd(EOL))
+ 0.0002327 /NodeList/4/DeviceList/2/$ns3::PointToPointNetDevice/TxQueue/Enqueue ns3::PppHeader (Point-to-Point Protocol: IP (0x0021)) ns3::Ipv4Header (tos 0x0 DSCP Default ECN Not-ECT ttl 63 id 0 protocol 6 offset (bytes) 0 flags [none] length: 56 10.1.8.1 > 10.1.3.4) ns3::TcpHeader (999 > 49153 [SYN|ACK] Seq=0 Ack=1 Win=2048 ns3::TcpOptionWinScale(0) ns3::TcpOptionMpTcpCapable(MP_CAPABLE: flags=1] Sender's Key :[887]) ns3::TcpOptionEnd(EOL))
- 0.0002327 /NodeList/4/DeviceList/2/$ns3::PointToPointNetDevice/TxQueue/Dequeue ns3::PppHeader (Point-to-Point Protocol: IP (0x0021)) ns3::Ipv4Header (tos 0x0 DSCP Default ECN Not-ECT ttl 63 id 0 protocol 6 offset (bytes) 0 flags [none] length: 56 10.1.8.1 > 10.1.3.4) ns3::TcpHeader (999 > 49153 [SYN|ACK] Seq=0 Ack=1 Win=2048 ns3::TcpOptionWinScale(0) ns3::TcpOptionMpTcpCapable(MP_CAPABLE: flags=1] Sender's Key :[887]) ns3::TcpOptionEnd(EOL))
r 0.000464701 /NodeList/2/DeviceList/3/$ns3::PointToPointNetDevice/MacRx ns3::PppHeader (Point-to-Point Protocol: IP (0x0021)) ns3::Ipv4Header (tos 0x0 DSCP Default ECN Not-ECT ttl 63 id 0 protocol 6 offset (bytes) 0 flags [none] length: 56 10.1.8.1 > 10.1.3.4) ns3::TcpHeader (999 > 49153 [SYN|ACK] Seq=0 Ack=1 Win=2048 ns3::TcpOptionWinScale(0) ns3::TcpOptionMpTcpCapable(MP_CAPABLE: flags=1] Sender's Key :[887]) ns3::TcpOptionEnd(EOL))
+ 0.000464701 /NodeList/2/DeviceList/5/$ns3::PointToPointNetDevice/TxQueue/Enqueue ns3::PppHeader (Point-to-Point Protocol: IP (0x0021)) ns3::Ipv4Header (tos 0x0 DSCP Default ECN Not-ECT ttl 62 id 0 protocol 6 offset (bytes) 0 flags [none] length: 56 10.1.8.1 > 10.1.3.4) ns3::TcpHeader (999 > 49153 [SYN|ACK] Seq=0 Ack=1 Win=2048 ns3::TcpOptionWinScale(0) ns3::TcpOptionMpTcpCapable(MP_CAPABLE: flags=1] Sender's Key :[887]) ns3::TcpOptionEnd(EOL))
- 0.000464701 /NodeList/2/DeviceList/5/$ns3::PointToPointNetDevice/TxQueue/Dequeue ns3::PppHeader (Point-to-Point Protocol: IP (0x0021)) ns3::Ipv4Header (tos 0x0 DSCP Default ECN Not-ECT ttl 62 id 0 protocol 6 offset (bytes) 0 flags [none] length: 56 10.1.8.1 > 10.1.3.4) ns3::TcpHeader (999 > 49153 [SYN|ACK] Seq=0 Ack=1 Win=2048 ns3::TcpOptionWinScale(0) ns3::TcpOptionMpTcpCapable(MP_CAPABLE: flags=1] Sender's Key :[887]) ns3::TcpOptionEnd(EOL))
r 0.000464934 /NodeList/0/DeviceList/2/$ns3::PointToPointNetDevice/MacRx ns3::PppHeader (Point-to-Point Protocol: IP (0x0021)) ns3::Ipv4Header (tos 0x0 DSCP Default ECN Not-ECT ttl 62 id 0 protocol 6 offset (bytes) 0 flags [none] length: 56 10.1.8.1 > 10.1.3.4) ns3::TcpHeader (999 > 49153 [SYN|ACK] Seq=0 Ack=1 Win=2048 ns3::TcpOptionWinScale(0) ns3::TcpOptionMpTcpCapable(MP_CAPABLE: flags=1] Sender's Key :[887]) ns3::TcpOptionEnd(EOL))
+ 0.000464934 /NodeList/0/DeviceList/2/$ns3::PointToPointNetDevice/TxQueue/Enqueue ns3::PppHeader (Point-to-Point Protocol: IP (0x0021)) ns3::Ipv4Header (tos 0x0 DSCP Default ECN Not-ECT ttl 64 id 1 protocol 6 offset (bytes) 0 flags [none] length: 60 10.1.3.4 > 10.1.8.1) ns3::TcpHeader (49153 > 999 [ACK] Seq=1 Ack=1 Win=2048 ns3::TcpOptionMpTcpCapable(MP_CAPABLE: flags=1] Sender's Key :[384] Peer's Key [887]))
- 0.000464934 /NodeList/0/DeviceList/2/$ns3::PointToPointNetDevice/TxQueue/Dequeue ns3::PppHeader (Point-to-Point Protocol: IP (0x0021)) ns3::Ipv4Header (tos 0x0 DSCP Default ECN Not-ECT ttl 64 id 1 protocol 6 offset (bytes) 0 flags [none] length: 60 10.1.3.4 > 10.1.8.1) ns3::TcpHeader (49153 > 999 [ACK] Seq=1 Ack=1 Win=2048 ns3::TcpOptionMpTcpCapable(MP_CAPABLE: flags=1] Sender's Key :[384] Peer's Key [887]))
r 0.000465183 /NodeList/2/DeviceList/5/$ns3::PointToPointNetDevice/MacRx ns3::PppHeader (Point-to-Point Protocol: IP (0x0021)) ns3::Ipv4Header (tos 0x0 DSCP Default ECN Not-ECT ttl 64 id 1 protocol 6 offset (bytes) 0 flags [none] length: 60 10.1.3.4 > 10.1.8.1) ns3::TcpHeader (49153 > 999 [ACK] Seq=1 Ack=1 Win=2048 ns3::TcpOptionMpTcpCapable(MP_CAPABLE: flags=1] Sender's Key :[384] Peer's Key [887]))
+ 0.000465183 /NodeList/2/DeviceList/3/$ns3::PointToPointNetDevice/TxQueue/Enqueue ns3::PppHeader (Point-to-Point Protocol: IP (0x0021)) ns3::Ipv4Header (tos 0x0 DSCP Default ECN Not-ECT ttl 63 id 1 protocol 6 offset (bytes) 0 flags [none] length: 60 10.1.3.4 > 10.1.8.1) ns3::TcpHeader (49153 > 999 [ACK] Seq=1 Ack=1 Win=2048 ns3::TcpOptionMpTcpCapable(MP_CAPABLE: flags=1] Sender's Key :[384] Peer's Key [887]))
- 0.000465183 /NodeList/2/DeviceList/3/$ns3::PointToPointNetDevice/TxQueue/Dequeue ns3::PppHeader (Point-to-Point Protocol: IP (0x0021)) ns3::Ipv4Header (tos 0x0 DSCP Default ECN Not-ECT ttl 63 id 1 protocol 6 offset (bytes) 0 flags [none] length: 60 10.1.3.4 > 10.1.8.1) ns3::TcpHeader (49153 > 999 [ACK] Seq=1 Ack=1 Win=2048 ns3::TcpOptionMpTcpCapable(MP_CAPABLE: flags=1] Sender's Key :[384] Peer's Key [887]))
r 0.000713184 /NodeList/4/DeviceList/2/$ns3::PointToPointNetDevice/MacRx ns3::PppHeader (Point-to-Point Protocol: IP (0x0021)) ns3::Ipv4Header (tos 0x0 DSCP Default ECN Not-ECT ttl 63 id 1 protocol 6 offset (bytes) 0 flags [none] length: 60 10.1.3.4 > 10.1.8.1) ns3::TcpHeader (49153 > 999 [ACK] Seq=1 Ack=1 Win=2048 ns3::TcpOptionMpTcpCapable(MP_CAPABLE: flags=1] Sender's Key :[384] Peer's Key [887]))
+ 0.000713184 /NodeList/4/DeviceList/3/$ns3::PointToPointNetDevice/TxQueue/Enqueue ns3::PppHeader (Point-to-Point Protocol: IP (0x0021)) ns3::Ipv4Header (tos 0x0 DSCP Default ECN Not-ECT ttl 62 id 1 protocol 6 offset (bytes) 0 flags [none] length: 60 10.1.3.4 > 10.1.8.1) ns3::TcpHeader (49153 > 999 [ACK] Seq=1 Ack=1 Win=2048 ns3::TcpOptionMpTcpCapable(MP_CAPABLE: flags=1] Sender's Key :[384] Peer's Key [887]))
- 0.000713184 /NodeList/4/DeviceList/3/$ns3::PointToPointNetDevice/TxQueue/Dequeue ns3::PppHeader (Point-to-Point Protocol: IP (0x0021)) ns3::Ipv4Header (tos 0x0 DSCP Default ECN Not-ECT ttl 62 id 1 protocol 6 offset (bytes) 0 flags [none] length: 60 10.1.3.4 > 10.1.8.1) ns3::TcpHeader (49153 > 999 [ACK] Seq=1 Ack=1 Win=2048 ns3::TcpOptionMpTcpCapable(MP_CAPABLE: flags=1] Sender's Key :[384] Peer's Key [887]))
r 0.000713433 /NodeList/1/DeviceList/3/$ns3::PointToPointNetDevice/MacRx ns3::PppHeader (Point-to-Point Protocol: IP (0x0021)) ns3::Ipv4Header (tos 0x0 DSCP Default ECN Not-ECT ttl 62 id 1 protocol 6 offset (bytes) 0 flags [none] length: 60 10.1.3.4 > 10.1.8.1) ns3::TcpHeader (49153 > 999 [ACK] Seq=1 Ack=1 Win=2048 ns3::TcpOptionMpTcpCapable(MP_CAPABLE: flags=1] Sender's Key :[384] Peer's Key [887]))
+ 0.000713433 /NodeList/1/DeviceList/2/$ns3::PointToPointNetDevice/TxQueue/Enqueue ns3::PppHeader (Point-to-Point Protocol: IP (0x0021)) ns3::Ipv4Header (tos 0x0 DSCP Default ECN Not-ECT ttl 64 id 1 protocol 6 offset (bytes) 0 flags [none] length: 72 10.1.8.1 > 10.1.3.4) ns3::TcpHeader (999 > 49153 [ACK] Seq=0 Ack=0 Win=65535 ns3::TcpOptionMpTcpAddAddress(ADD_ADDR: address id=d associated to IP:port [10.1.6.2:999]) ns3::TcpOptionMpTcpAddAddress(ADD_ADDR: address id=n associated to IP:port [10.1.7.2:999]) ns3::TcpOptionMpTcpAddAddress(ADD_ADDR: address id=x associated to IP:port [10.1.8.1:999]) ns3::TcpOptionEnd(EOL))
- 0.000713433 /NodeList/1/DeviceList/2/$ns3::PointToPointNetDevice/TxQueue/Dequeue ns3::PppHeader (Point-to-Point Protocol: IP (0x0021)) ns3::Ipv4Header (tos 0x0 DSCP Default ECN Not-ECT ttl 64 id 1 protocol 6 offset (bytes) 0 flags [none] length: 72 10.1.8.1 > 10.1.3.4) ns3::TcpHeader (999 > 49153 [ACK] Seq=0 Ack=0 Win=65535 ns3::TcpOptionMpTcpAddAddress(ADD_ADDR: address id=d associated to IP:port [10.1.6.2:999]) ns3::TcpOptionMpTcpAddAddress(ADD_ADDR: address id=n associated to IP:port [10.1.7.2:999]) ns3::TcpOptionMpTcpAddAddress(ADD_ADDR: address id=x associated to IP:port [10.1.8.1:999]) ns3::TcpOptionEnd(EOL))
r 0.000713729 /NodeList/3/DeviceList/3/$ns3::PointToPointNetDevice/MacRx ns3::PppHeader (Point-to-Point Protocol: IP (0x0021)) ns3::Ipv4Header (tos 0x0 DSCP Default ECN Not-ECT ttl 64 id 1 protocol 6 offset (bytes) 0 flags [none] length: 72 10.1.8.1 > 10.1.3.4) ns3::TcpHeader (999 > 49153 [ACK] Seq=0 Ack=0 Win=65535 ns3::TcpOptionMpTcpAddAddress(ADD_ADDR: address id=d associated to IP:port [10.1.6.2:999]) ns3::TcpOptionMpTcpAddAddress(ADD_ADDR: address id=n associated to IP:port [10.1.7.2:999]) ns3::TcpOptionMpTcpAddAddress(ADD_ADDR: address id=x associated to IP:port [10.1.8.1:999]) ns3::TcpOptionEnd(EOL))
+ 0.000713729 /NodeList/3/DeviceList/2/$ns3::PointToPointNetDevice/TxQueue/Enqueue ns3::PppHeader (Point-to-Point Protocol: IP (0x0021)) ns3::Ipv4Header (tos 0x0 DSCP Default ECN Not-ECT ttl 63 id 1 protocol 6 offset (bytes) 0 flags [none] length: 72 10.1.8.1 > 10.1.3.4) ns3::TcpHeader (999 > 49153 [ACK] Seq=0 Ack=0 Win=65535 ns3::TcpOptionMpTcpAddAddress(ADD_ADDR: address id=d associated to IP:port [10.1.6.2:999]) ns3::TcpOptionMpTcpAddAddress(ADD_ADDR: address id=n associated to IP:port [10.1.7.2:999]) ns3::TcpOptionMpTcpAddAddress(ADD_ADDR: address id=x associated to IP:port [10.1.8.1:999]) ns3::TcpOptionEnd(EOL))
- 0.000713729 /NodeList/3/DeviceList/2/$ns3::PointToPointNetDevice/TxQueue/Dequeue ns3::PppHeader (Point-to-Point Protocol: IP (0x0021)) ns3::Ipv4Header (tos 0x0 DSCP Default ECN Not-ECT ttl 63 id 1 protocol 6 offset (bytes) 0 flags [none] length: 72 10.1.8.1 > 10.1.3.4) ns3::TcpHeader (999 > 49153 [ACK] Seq=0 Ack=0 Win=65535 ns3::TcpOptionMpTcpAddAddress(ADD_ADDR: address id=d associated to IP:port [10.1.6.2:999]) ns3::TcpOptionMpTcpAddAddress(ADD_ADDR: address id=n associated to IP:port [10.1.7.2:999]) ns3::TcpOptionMpTcpAddAddress(ADD_ADDR: address id=x associated to IP:port [10.1.8.1:999]) ns3::TcpOptionEnd(EOL))
r 0.00100973 /NodeList/2/DeviceList/2/$ns3::PointToPointNetDevice/MacRx ns3::PppHeader (Point-to-Point Protocol: IP (0x0021)) ns3::Ipv4Header (tos 0x0 DSCP Default ECN Not-ECT ttl 63 id 1 protocol 6 offset (bytes) 0 flags [none] length: 72 10.1.8.1 > 10.1.3.4) ns3::TcpHeader (999 > 49153 [ACK] Seq=0 Ack=0 Win=65535 ns3::TcpOptionMpTcpAddAddress(ADD_ADDR: address id=d associated to IP:port [10.1.6.2:999]) ns3::TcpOptionMpTcpAddAddress(ADD_ADDR: address id=n associated to IP:port [10.1.7.2:999]) ns3::TcpOptionMpTcpAddAddress(ADD_ADDR: address id=x associated to IP:port [10.1.8.1:999]) ns3::TcpOptionEnd(EOL))
+ 0.00100973 /NodeList/2/DeviceList/5/$ns3::PointToPointNetDevice/TxQueue/Enqueue ns3::PppHeader (Point-to-Point Protocol: IP (0x0021)) ns3::Ipv4Header (tos 0x0 DSCP Default ECN Not-ECT ttl 62 id 1 protocol 6 offset (bytes) 0 flags [none] length: 72 10.1.8.1 > 10.1.3.4) ns3::TcpHeader (999 > 49153 [ACK] Seq=0 Ack=0 Win=65535 ns3::TcpOptionMpTcpAddAddress(ADD_ADDR: address id=d associated to IP:port [10.1.6.2:999]) ns3::TcpOptionMpTcpAddAddress(ADD_ADDR: address id=n associated to IP:port [10.1.7.2:999]) ns3::TcpOptionMpTcpAddAddress(ADD_ADDR: address id=x associated to IP:port [10.1.8.1:999]) ns3::TcpOptionEnd(EOL))
- 0.00100973 /NodeList/2/DeviceList/5/$ns3::PointToPointNetDevice/TxQueue/Dequeue ns3::PppHeader (Point-to-Point Protocol: IP (0x0021)) ns3::Ipv4Header (tos 0x0 DSCP Default ECN Not-ECT ttl 62 id 1 protocol 6 offset (bytes) 0 flags [none] length: 72 10.1.8.1 > 10.1.3.4) ns3::TcpHeader (999 > 49153 [ACK] Seq=0 Ack=0 Win=65535 ns3::TcpOptionMpTcpAddAddress(ADD_ADDR: address id=d associated to IP:port [10.1.6.2:999]) ns3::TcpOptionMpTcpAddAddress(ADD_ADDR: address id=n associated to IP:port [10.1.7.2:999]) ns3::TcpOptionMpTcpAddAddress(ADD_ADDR: address id=x associated to IP:port [10.1.8.1:999]) ns3::TcpOptionEnd(EOL))
r 0.00101002 /NodeList/0/DeviceList/2/$ns3::PointToPointNetDevice/MacRx ns3::PppHeader (Point-to-Point Protocol: IP (0x0021)) ns3::Ipv4Header (tos 0x0 DSCP Default ECN Not-ECT ttl 62 id 1 protocol 6 offset (bytes) 0 flags [none] length: 72 10.1.8.1 > 10.1.3.4) ns3::TcpHeader (999 > 49153 [ACK] Seq=0 Ack=0 Win=65535 ns3::TcpOptionMpTcpAddAddress(ADD_ADDR: address id=d associated to IP:port [10.1.6.2:999]) ns3::TcpOptionMpTcpAddAddress(ADD_ADDR: address id=n associated to IP:port [10.1.7.2:999]) ns3::TcpOptionMpTcpAddAddress(ADD_ADDR: address id=x associated to IP:port [10.1.8.1:999]) ns3::TcpOptionEnd(EOL))
+ 0.008 /NodeList/0/DeviceList/2/$ns3::PointToPointNetDevice/TxQueue/Enqueue ns3::PppHeader (Point-to-Point Protocol: IP (0x0021)) ns3::Ipv4Header (tos 0x0 DSCP Default ECN Not-ECT ttl 64 id 2 protocol 6 offset (bytes) 0 flags [none] length: 1076 10.1.3.4 > 10.1.8.1) ns3::TcpHeader (49153 > 999 [ACK] Seq=1 Ack=1 Win=2048 ns3::TcpOptionMpTcpCapable(MP_CAPABLE: flags=1] Sender's Key :[384] Peer's Key [887]) ns3::TcpOptionMpTcpDSS( MP_DSS:  DSN:0 length=1000) ns3::TcpOptionEnd(EOL)) Payload (size=1000)
- 0.008 /NodeList/0/DeviceList/2/$ns3::PointToPointNetDevice/TxQueue/Dequeue ns3::PppHeader (Point-to-Point Protocol: IP (0x0021)) ns3::Ipv4Header (tos 0x0 DSCP Default ECN Not-ECT ttl 64 id 2 protocol 6 offset (bytes) 0 flags [none] length: 1076 10.1.3.4 > 10.1.8.1) ns3::TcpHeader (49153 > 999 [ACK] Seq=1 Ack=1 Win=2048 ns3::TcpOptionMpTcpCapable(MP_CAPABLE: flags=1] Sender's Key :[384] Peer's Key [887]) ns3::TcpOptionMpTcpDSS( MP_DSS:  DSN:0 length=1000) ns3::TcpOptionEnd(EOL)) Payload (size=1000)
r 0.00800431 /NodeList/2/DeviceList/5/$ns3::PointToPointNetDevice/MacRx ns3::PppHeader (Point-to-Point Protocol: IP (0x0021)) ns3::Ipv4Header (tos 0x0 DSCP Default ECN Not-ECT ttl 64 id 2 protocol 6 offset (bytes) 0 flags [none] length: 1076 10.1.3.4 > 10.1.8.1) ns3::TcpHeader (49153 > 999 [ACK] Seq=1 Ack=1 Win=2048 ns3::TcpOptionMpTcpCapable(MP_CAPABLE: flags=1] Sender's Key :[384] Peer's Key [887]) ns3::TcpOptionMpTcpDSS( MP_DSS:  DSN:0 length=1000) ns3::TcpOptionEnd(EOL)) Payload (size=1000)
+ 0.00800431 /NodeList/2/DeviceList/4/$ns3::PointToPointNetDevice/TxQueue/Enqueue ns3::PppHeader (Point-to-Point Protocol: IP (0x0021)) ns3::Ipv4Header (tos 0x0 DSCP Default ECN Not-ECT ttl 63 id 2 protocol 6 offset (bytes) 0 flags [none] length: 1076 10.1.3.4 > 10.1.8.1) ns3::TcpHeader (49153 > 999 [ACK] Seq=1 Ack=1 Win=2048 ns3::TcpOptionMpTcpCapable(MP_CAPABLE: flags=1] Sender's Key :[384] Peer's Key [887]) ns3::TcpOptionMpTcpDSS( MP_DSS:  DSN:0 length=1000) ns3::TcpOptionEnd(EOL)) Payload (size=1000)
- 0.00800431 /NodeList/2/DeviceList/4/$ns3::PointToPointNetDevice/TxQueue/Dequeue ns3::PppHeader (Point-to-Point Protocol: IP (0x0021)) ns3::Ipv4Header (tos 0x0 DSCP Default ECN Not-ECT ttl 63 id 2 protocol 6 offset (bytes) 0 flags [none] length: 1076 10.1.3.4 > 10.1.8.1) ns3::TcpHeader (49153 > 999 [ACK] Seq=1 Ack=1 Win=2048 ns3::TcpOptionMpTcpCapable(MP_CAPABLE: flags=1] Sender's Key :[384] Peer's Key [887]) ns3::TcpOptionMpTcpDSS( MP_DSS:  DSN:0 length=1000) ns3::TcpOptionEnd(EOL)) Payload (size=1000)
r 0.0123163 /NodeList/5/DeviceList/2/$ns3::PointToPointNetDevice/MacRx ns3::PppHeader (Point-to-Point Protocol: IP (0x0021)) ns3::Ipv4Header (tos 0x0 DSCP Default ECN Not-ECT ttl 63 id 2 protocol 6 offset (bytes) 0 flags [none] length: 1076 10.1.3.4 > 10.1.8.1) ns3::TcpHeader (49153 > 999 [ACK] Seq=1 Ack=1 Win=2048 ns3::TcpOptionMpTcpCapable(MP_CAPABLE: flags=1] Sender's Key :[384] Peer's Key [887]) ns3::TcpOptionMpTcpDSS( MP_DSS:  DSN:0 length=1000) ns3::TcpOptionEnd(EOL)) Payload (size=1000)
+ 0.0123163 /NodeList/5/DeviceList/3/$ns3::PointToPointNetDevice/TxQueue/Enqueue ns3::PppHeader (Point-to-Point Protocol: IP (0x0021)) ns3::Ipv4Header (tos 0x0 DSCP Default ECN Not-ECT ttl 62 id 2 protocol 6 offset (bytes) 0 flags [none] length: 1076 10.1.3.4 > 10.1.8.1) ns3::TcpHeader (49153 > 999 [ACK] Seq=1 Ack=1 Win=2048 ns3::TcpOptionMpTcpCapable(MP_CAPABLE: flags=1] Sender's Key :[384] Peer's Key [887]) ns3::TcpOptionMpTcpDSS( MP_DSS:  DSN:0 length=1000) ns3::TcpOptionEnd(EOL)) Payload (size=1000)
- 0.0123163 /NodeList/5/DeviceList/3/$ns3::PointToPointNetDevice/TxQueue/Dequeue ns3::PppHeader (Point-to-Point Protocol: IP (0x0021)) ns3::Ipv4Header (tos 0x0 DSCP Default ECN Not-ECT ttl 62 id 2 protocol 6 offset (bytes) 0 flags [none] length: 1076 10.1.3.4 > 10.1.8.1) ns3::TcpHeader (49153 > 999 [ACK] Seq=1 Ack=1 Win=2048 ns3::TcpOptionMpTcpCapable(MP_CAPABLE: flags=1] Sender's Key :[384] Peer's Key [887]) ns3::TcpOptionMpTcpDSS( MP_DSS:  DSN:0 length=1000) ns3::TcpOptionEnd(EOL)) Payload (size=1000)
r 0.0123206 /NodeList/1/DeviceList/4/$ns3::PointToPointNetDevice/MacRx ns3::PppHeader (Point-to-Point Protocol: IP (0x0021)) ns3::Ipv4Header (tos 0x0 DSCP Default ECN Not-ECT ttl 62 id 2 protocol 6 offset (bytes) 0 flags [none] length: 1076 10.1.3.4 > 10.1.8.1) ns3::TcpHeader (49153 > 999 [ACK] Seq=1 Ack=1 Win=2048 ns3::TcpOptionMpTcpCapable(MP_CAPABLE: flags=1] Sender's Key :[384] Peer's Key [887]) ns3::TcpOptionMpTcpDSS( MP_DSS:  DSN:0 length=1000) ns3::TcpOptionEnd(EOL)) Payload (size=1000)
+ 0.0123206 /NodeList/1/DeviceList/2/$ns3::PointToPointNetDevice/TxQueue/Enqueue ns3::PppHeader (Point-to-Point Protocol: IP (0x0021)) ns3::Ipv4Header (tos 0x0 DSCP Default ECN Not-ECT ttl 64 id 2 protocol 6 offset (bytes) 0 flags [none] length: 48 10.1.8.1 > 10.1.3.4) ns3::TcpHeader (999 > 49153 [ACK] Seq=1 Ack=1001 Win=2048 ns3::TcpOptionMpTcpDSS( MP_DSS: Acknowledges [1000] ))
- 0.0123206 /NodeList/1/DeviceList/2/$ns3::PointToPointNetDevice/TxQueue/Dequeue ns3::PppHeader (Point-to-Point Protocol: IP (0x0021)) ns3::Ipv4Header (tos 0x0 DSCP Default ECN Not-ECT ttl 64 id 2 protocol 6 offset (bytes) 0 flags [none] length: 48 10.1.8.1 > 10.1.3.4) ns3::TcpHeader (999 > 49153 [ACK] Seq=1 Ack=1001 Win=2048 ns3::TcpOptionMpTcpDSS( MP_DSS: Acknowledges [1000] ))
r 0.0123208 /NodeList/3/DeviceList/3/$ns3::PointToPointNetDevice/MacRx ns3::PppHeader (Point-to-Point Protocol: IP (0x0021)) ns3::Ipv4Header (tos 0x0 DSCP Default ECN Not-ECT ttl 64 id 2 protocol 6 offset (bytes) 0 flags [none] length: 48 10.1.8.1 > 10.1.3.4) ns3::TcpHeader (999 > 49153 [ACK] Seq=1 Ack=1001 Win=2048 ns3::TcpOptionMpTcpDSS( MP_DSS: Acknowledges [1000] ))
+ 0.0123208 /NodeList/3/DeviceList/2/$ns3::PointToPointNetDevice/TxQueue/Enqueue ns3::PppHeader (Point-to-Point Protocol: IP (0x0021)) ns3::Ipv4Header (tos 0x0 DSCP Default ECN Not-ECT ttl 63 id 2 protocol 6 offset (bytes) 0 flags [none] length: 48 10.1.8.1 > 10.1.3.4) ns3::TcpHeader (999 > 49153 [ACK] Seq=1 Ack=1001 Win=2048 ns3::TcpOptionMpTcpDSS( MP_DSS: Acknowledges [1000] ))
- 0.0123208 /NodeList/3/DeviceList/2/$ns3::PointToPointNetDevice/TxQueue/Dequeue ns3::PppHeader (Point-to-Point Protocol: IP (0x0021)) ns3::Ipv4Header (tos 0x0 DSCP Default ECN Not-ECT ttl 63 id 2 protocol 6 offset (bytes) 0 flags [none] length: 48 10.1.8.1 > 10.1.3.4) ns3::TcpHeader (999 > 49153 [ACK] Seq=1 Ack=1001 Win=2048 ns3::TcpOptionMpTcpDSS( MP_DSS: Acknowledges [1000] ))
r 0.0125208 /NodeList/2/DeviceList/2/$ns3::PointToPointNetDevice/MacRx ns3::PppHeader (Point-to-Point Protocol: IP (0x0021)) ns3::Ipv4Header (tos 0x0 DSCP Default ECN Not-ECT ttl 63 id 2 protocol 6 offset (bytes) 0 flags [none] length: 48 10.1.8.1 > 10.1.3.4) ns3::TcpHeader (999 > 49153 [ACK] Seq=1 Ack=1001 Win=2048 ns3::TcpOptionMpTcpDSS( MP_DSS: Acknowledges [1000] ))
+ 0.0125208 /NodeList/2/DeviceList/5/$ns3::PointToPointNetDevice/TxQueue/Enqueue ns3::PppHeader (Point-to-Point Protocol: IP (0x0021)) ns3::Ipv4Header (tos 0x0 DSCP Default ECN Not-ECT ttl 62 id 2 protocol 6 offset (bytes) 0 flags [none] length: 48 10.1.8.1 > 10.1.3.4) ns3::TcpHeader (999 > 49153 [ACK] Seq=1 Ack=1001 Win=2048 ns3::TcpOptionMpTcpDSS( MP_DSS: Acknowledges [1000] ))
- 0.0125208 /NodeList/2/DeviceList/5/$ns3::PointToPointNetDevice/TxQueue/Dequeue ns3::PppHeader (Point-to-Point Protocol: IP (0x0021)) ns3::Ipv4Header (tos 0x0 DSCP Default ECN Not-ECT ttl 62 id 2 protocol 6 offset (bytes) 0 flags [none] length: 48 10.1.8.1 > 10.1.3.4) ns3::TcpHeader (999 > 49153 [ACK] Seq=1 Ack=1001 Win=2048 ns3::TcpOptionMpTcpDSS( MP_DSS: Acknowledges [1000] ))
r 0.012521 /NodeList/0/DeviceList/2/$ns3::PointToPointNetDevice/MacRx ns3::PppHeader (Point-to-Point Protocol: IP (0x0021)) ns3::Ipv4Header (tos 0x0 DSCP Default ECN Not-ECT ttl 62 id 2 protocol 6 offset (bytes) 0 flags [none] length: 48 10.1.8.1 > 10.1.3.4) ns3::TcpHeader (999 > 49153 [ACK] Seq=1 Ack=1001 Win=2048 ns3::TcpOptionMpTcpDSS( MP_DSS: Acknowledges [1000] ))
+ 0.016 /NodeList/0/DeviceList/2/$ns3::PointToPointNetDevice/TxQueue/Enqueue ns3::PppHeader (Point-to-Point Protocol: IP (0x0021)) ns3::Ipv4Header (tos 0x0 DSCP Default ECN Not-ECT ttl 64 id 0 protocol 6 offset (bytes) 0 flags [none] length: 56 10.1.3.4 > 10.1.6.2) ns3::TcpHeader (12777 > 1915 [SYN] Seq=0 Ack=0 Win=2048 ns3::TcpOptionWinScale(0) ns3::TcpOptionMpTcpJoin(MP_JOIN: [Syn] with token=887, nonce=887) ns3::TcpOptionEnd(EOL))
- 0.016 /NodeList/0/DeviceList/2/$ns3::PointToPointNetDevice/TxQueue/Dequeue ns3::PppHeader (Point-to-Point Protocol: IP (0x0021)) ns3::Ipv4Header (tos 0x0 DSCP Default ECN Not-ECT ttl 64 id 0 protocol 6 offset (bytes) 0 flags [none] length: 56 10.1.3.4 > 10.1.6.2) ns3::TcpHeader (12777 > 1915 [SYN] Seq=0 Ack=0 Win=2048 ns3::TcpOptionWinScale(0) ns3::TcpOptionMpTcpJoin(MP_JOIN: [Syn] with token=887, nonce=887) ns3::TcpOptionEnd(EOL))
+ 0.016 /NodeList/0/DeviceList/2/$ns3::PointToPointNetDevice/TxQueue/Enqueue ns3::PppHeader (Point-to-Point Protocol: IP (0x0021)) ns3::Ipv4Header (tos 0x0 DSCP Default ECN Not-ECT ttl 64 id 0 protocol 6 offset (bytes) 0 flags [none] length: 56 10.1.3.4 > 10.1.7.2) ns3::TcpHeader (12793 > 48335 [SYN] Seq=0 Ack=0 Win=2048 ns3::TcpOptionWinScale(0) ns3::TcpOptionMpTcpJoin(MP_JOIN: [Syn] with token=887, nonce=887) ns3::TcpOptionEnd(EOL))
+ 0.016 /NodeList/0/DeviceList/2/$ns3::PointToPointNetDevice/TxQueue/Enqueue ns3::PppHeader (Point-to-Point Protocol: IP (0x0021)) ns3::Ipv4Header (tos 0x0 DSCP Default ECN Not-ECT ttl 64 id 3 protocol 6 offset (bytes) 0 flags [none] length: 1060 10.1.3.4 > 10.1.8.1) ns3::TcpHeader (49153 > 999 [ACK] Seq=1001 Ack=1 Win=2048 ns3::TcpOptionMpTcpDSS( MP_DSS: Acknowledges [0]  DSN:1000 length=1000) ns3::TcpOptionEnd(EOL)) Payload (size=1000)
- 0.0160002 /NodeList/0/DeviceList/2/$ns3::PointToPointNetDevice/TxQueue/Dequeue ns3::PppHeader (Point-to-Point Protocol: IP (0x0021)) ns3::Ipv4Header (tos 0x0 DSCP Default ECN Not-ECT ttl 64 id 0 protocol 6 offset (bytes) 0 flags [none] length: 56 10.1.3.4 > 10.1.7.2) ns3::TcpHeader (12793 > 48335 [SYN] Seq=0 Ack=0 Win=2048 ns3::TcpOptionWinScale(0) ns3::TcpOptionMpTcpJoin(MP_JOIN: [Syn] with token=887, nonce=887) ns3::TcpOptionEnd(EOL))
r 0.0160002 /NodeList/2/DeviceList/5/$ns3::PointToPointNetDevice/MacRx ns3::PppHeader (Point-to-Point Protocol: IP (0x0021)) ns3::Ipv4Header (tos 0x0 DSCP Default ECN Not-ECT ttl 64 id 0 protocol 6 offset (bytes) 0 flags [none] length: 56 10.1.3.4 > 10.1.6.2) ns3::TcpHeader (12777 > 1915 [SYN] Seq=0 Ack=0 Win=2048 ns3::TcpOptionWinScale(0) ns3::TcpOptionMpTcpJoin(MP_JOIN: [Syn] with token=887, nonce=887) ns3::TcpOptionEnd(EOL))
+ 0.0160002 /NodeList/2/DeviceList/2/$ns3::PointToPointNetDevice/TxQueue/Enqueue ns3::PppHeader (Point-to-Point Protocol: IP (0x0021)) ns3::Ipv4Header (tos 0x0 DSCP Default ECN Not-ECT ttl 63 id 0 protocol 6 offset (bytes) 0 flags [none] length: 56 10.1.3.4 > 10.1.6.2) ns3::TcpHeader (12777 > 1915 [SYN] Seq=0 Ack=0 Win=2048 ns3::TcpOptionWinScale(0) ns3::TcpOptionMpTcpJoin(MP_JOIN: [Syn] with token=887, nonce=887) ns3::TcpOptionEnd(EOL))
- 0.0160002 /NodeList/2/DeviceList/2/$ns3::PointToPointNetDevice/TxQueue/Dequeue ns3::PppHeader (Point-to-Point Protocol: IP (0x0021)) ns3::Ipv4Header (tos 0x0 DSCP Default ECN Not-ECT ttl 63 id 0 protocol 6 offset (bytes) 0 flags [none] length: 56 10.1.3.4 > 10.1.6.2) ns3::TcpHeader (12777 > 1915 [SYN] Seq=0 Ack=0 Win=2048 ns3::TcpOptionWinScale(0) ns3::TcpOptionMpTcpJoin(MP_JOIN: [Syn] with token=887, nonce=887) ns3::TcpOptionEnd(EOL))
- 0.0160005 /NodeList/0/DeviceList/2/$ns3::PointToPointNetDevice/TxQueue/Dequeue ns3::PppHeader (Point-to-Point Protocol: IP (0x0021)) ns3::Ipv4Header (tos 0x0 DSCP Default ECN Not-ECT ttl 64 id 3 protocol 6 offset (bytes) 0 flags [none] length: 1060 10.1.3.4 > 10.1.8.1) ns3::TcpHeader (49153 > 999 [ACK] Seq=1001 Ack=1 Win=2048 ns3::TcpOptionMpTcpDSS( MP_DSS: Acknowledges [0]  DSN:1000 length=1000) ns3::TcpOptionEnd(EOL)) Payload (size=1000)
r 0.0160005 /NodeList/2/DeviceList/5/$ns3::PointToPointNetDevice/MacRx ns3::PppHeader (Point-to-Point Protocol: IP (0x0021)) ns3::Ipv4Header (tos 0x0 DSCP Default ECN Not-ECT ttl 64 id 0 protocol 6 offset (bytes) 0 flags [none] length: 56 10.1.3.4 > 10.1.7.2) ns3::TcpHeader (12793 > 48335 [SYN] Seq=0 Ack=0 Win=2048 ns3::TcpOptionWinScale(0) ns3::TcpOptionMpTcpJoin(MP_JOIN: [Syn] with token=887, nonce=887) ns3::TcpOptionEnd(EOL))
+ 0.0160005 /NodeList/2/DeviceList/2/$ns3::PointToPointNetDevice/TxQueue/Enqueue ns3::PppHeader (Point-to-Point Protocol: IP (0x0021)) ns3::Ipv4Header (tos 0x0 DSCP Default ECN Not-ECT ttl 63 id 0 protocol 6 offset (bytes) 0 flags [none] length: 56 10.1.3.4 > 10.1.7.2) ns3::TcpHeader (12793 > 48335 [SYN] Seq=0 Ack=0 Win=2048 ns3::TcpOptionWinScale(0) ns3::TcpOptionMpTcpJoin(MP_JOIN: [Syn] with token=887, nonce=887) ns3::TcpOptionEnd(EOL))
r 0.0160047 /NodeList/2/DeviceList/5/$ns3::PointToPointNetDevice/MacRx ns3::PppHeader (Point-to-Point Protocol: IP (0x0021)) ns3::Ipv4Header (tos 0x0 DSCP Default ECN Not-ECT ttl 64 id 3 protocol 6 offset (bytes) 0 flags [none] length: 1060 10.1.3.4 > 10.1.8.1) ns3::TcpHeader (49153 > 999 [ACK] Seq=1001 Ack=1 Win=2048 ns3::TcpOptionMpTcpDSS( MP_DSS: Acknowledges [0]  DSN:1000 length=1000) ns3::TcpOptionEnd(EOL)) Payload (size=1000)
+ 0.0160047 /NodeList/2/DeviceList/3/$ns3::PointToPointNetDevice/TxQueue/Enqueue ns3::PppHeader (Point-to-Point Protocol: IP (0x0021)) ns3::Ipv4Header (tos 0x0 DSCP Default ECN Not-ECT ttl 63 id 3 protocol 6 offset (bytes) 0 flags [none] length: 1060 10.1.3.4 > 10.1.8.1) ns3::TcpHeader (49153 > 999 [ACK] Seq=1001 Ack=1 Win=2048 ns3::TcpOptionMpTcpDSS( MP_DSS: Acknowledges [0]  DSN:1000 length=1000) ns3::TcpOptionEnd(EOL)) Payload (size=1000)
- 0.0160047 /NodeList/2/DeviceList/3/$ns3::PointToPointNetDevice/TxQueue/Dequeue ns3::PppHeader (Point-to-Point Protocol: IP (0x0021)) ns3::Ipv4Header (tos 0x0 DSCP Default ECN Not-ECT ttl 63 id 3 protocol 6 offset (bytes) 0 flags [none] length: 1060 10.1.3.4 > 10.1.8.1) ns3::TcpHeader (49153 > 999 [ACK] Seq=1001 Ack=1 Win=2048 ns3::TcpOptionMpTcpDSS( MP_DSS: Acknowledges [0]  DSN:1000 length=1000) ns3::TcpOptionEnd(EOL)) Payload (size=1000)
- 0.0162322 /NodeList/2/DeviceList/2/$ns3::PointToPointNetDevice/TxQueue/Dequeue ns3::PppHeader (Point-to-Point Protocol: IP (0x0021)) ns3::Ipv4Header (tos 0x0 DSCP Default ECN Not-ECT ttl 63 id 0 protocol 6 offset (bytes) 0 flags [none] length: 56 10.1.3.4 > 10.1.7.2) ns3::TcpHeader (12793 > 48335 [SYN] Seq=0 Ack=0 Win=2048 ns3::TcpOptionWinScale(0) ns3::TcpOptionMpTcpJoin(MP_JOIN: [Syn] with token=887, nonce=887) ns3::TcpOptionEnd(EOL))
r 0.0162322 /NodeList/3/DeviceList/2/$ns3::PointToPointNetDevice/MacRx ns3::PppHeader (Point-to-Point Protocol: IP (0x0021)) ns3::Ipv4Header (tos 0x0 DSCP Default ECN Not-ECT ttl 63 id 0 protocol 6 offset (bytes) 0 flags [none] length: 56 10.1.3.4 > 10.1.6.2) ns3::TcpHeader (12777 > 1915 [SYN] Seq=0 Ack=0 Win=2048 ns3::TcpOptionWinScale(0) ns3::TcpOptionMpTcpJoin(MP_JOIN: [Syn] with token=887, nonce=887) ns3::TcpOptionEnd(EOL))
+ 0.0162322 /NodeList/3/DeviceList/3/$ns3::PointToPointNetDevice/TxQueue/Enqueue ns3::PppHeader (Point-to-Point Protocol: IP (0x0021)) ns3::Ipv4Header (tos 0x0 DSCP Default ECN Not-ECT ttl 62 id 0 protocol 6 offset (bytes) 0 flags [none] length: 56 10.1.3.4 > 10.1.6.2) ns3::TcpHeader (12777 > 1915 [SYN] Seq=0 Ack=0 Win=2048 ns3::TcpOptionWinScale(0) ns3::TcpOptionMpTcpJoin(MP_JOIN: [Syn] with token=887, nonce=887) ns3::TcpOptionEnd(EOL))
- 0.0162322 /NodeList/3/DeviceList/3/$ns3::PointToPointNetDevice/TxQueue/Dequeue ns3::PppHeader (Point-to-Point Protocol: IP (0x0021)) ns3::Ipv4Header (tos 0x0 DSCP Default ECN Not-ECT ttl 62 id 0 protocol 6 offset (bytes) 0 flags [none] length: 56 10.1.3.4 > 10.1.6.2) ns3::TcpHeader (12777 > 1915 [SYN] Seq=0 Ack=0 Win=2048 ns3::TcpOptionWinScale(0) ns3::TcpOptionMpTcpJoin(MP_JOIN: [Syn] with token=887, nonce=887) ns3::TcpOptionEnd(EOL))
r 0.0162325 /NodeList/1/DeviceList/2/$ns3::PointToPointNetDevice/MacRx ns3::PppHeader (Point-to-Point Protocol: IP (0x0021)) ns3::Ipv4Header (tos 0x0 DSCP Default ECN Not-ECT ttl 62 id 0 protocol 6 offset (bytes) 0 flags [none] length: 56 10.1.3.4 > 10.1.6.2) ns3::TcpHeader (12777 > 1915 [SYN] Seq=0 Ack=0 Win=2048 ns3::TcpOptionWinScale(0) ns3::TcpOptionMpTcpJoin(MP_JOIN: [Syn] with token=887, nonce=887) ns3::TcpOptionEnd(EOL))
+ 0.0162325 /NodeList/1/DeviceList/3/$ns3::PointToPointNetDevice/TxQueue/Enqueue ns3::PppHeader (Point-to-Point Protocol: IP (0x0021)) ns3::Ipv4Header (tos 0x0 DSCP Default ECN Not-ECT ttl 64 id 0 protocol 6 offset (bytes) 0 flags [none] length: 60 10.1.6.2 > 10.1.3.4) ns3::TcpHeader (1915 > 12777 [SYN|ACK] Seq=0 Ack=1 Win=2048 ns3::TcpOptionWinScale(0) ns3::TcpOptionMpTcpJoin(MP_JOIN: [SynAck] with nonce=0, HMAC-B=424242) ns3::TcpOptionEnd(EOL))
- 0.0162325 /NodeList/1/DeviceList/3/$ns3::PointToPointNetDevice/TxQueue/Dequeue ns3::PppHeader (Point-to-Point Protocol: IP (0x0021)) ns3::Ipv4Header (tos 0x0 DSCP Default ECN Not-ECT ttl 64 id 0 protocol 6 offset (bytes) 0 flags [none] length: 60 10.1.6.2 > 10.1.3.4) ns3::TcpHeader (1915 > 12777 [SYN|ACK] Seq=0 Ack=1 Win=2048 ns3::TcpOptionWinScale(0) ns3::TcpOptionMpTcpJoin(MP_JOIN: [SynAck] with nonce=0, HMAC-B=424242) ns3::TcpOptionEnd(EOL))
+ 0.0162325 /NodeList/1/DeviceList/4/$ns3::PointToPointNetDevice/TxQueue/Enqueue ns3::PppHeader (Point-to-Point Protocol: IP (0x0021)) ns3::Ipv4Header (tos 0x0 DSCP Default ECN Not-ECT ttl 64 id 3 protocol 6 offset (bytes) 0 flags [none] length: 72 10.1.8.1 > 10.1.3.4) ns3::TcpHeader (999 > 49153 [ACK] Seq=0 Ack=1000 Win=65535 ns3::TcpOptionMpTcpAddAddress(ADD_ADDR: address id=d associated to IP:port [10.1.6.2:999]) ns3::TcpOptionMpTcpAddAddress(ADD_ADDR: address id=n associated to IP:port [10.1.7.2:999]) ns3::TcpOptionMpTcpAddAddress(ADD_ADDR: address id=x associated to IP:port [10.1.8.1:999]) ns3::TcpOptionEnd(EOL))
- 0.0162325 /NodeList/1/DeviceList/4/$ns3::PointToPointNetDevice/TxQueue/Dequeue ns3::PppHeader (Point-to-Point Protocol: IP (0x0021)) ns3::Ipv4Header (tos 0x0 DSCP Default ECN Not-ECT ttl 64 id 3 protocol 6 offset (bytes) 0 flags [none] length: 72 10.1.8.1 > 10.1.3.4) ns3::TcpHeader (999 > 49153 [ACK] Seq=0 Ack=1000 Win=65535 ns3::TcpOptionMpTcpAddAddress(ADD_ADDR: address id=d associated to IP:port [10.1.6.2:999]) ns3::TcpOptionMpTcpAddAddress(ADD_ADDR: address id=n associated to IP:port [10.1.7.2:999]) ns3::TcpOptionMpTcpAddAddress(ADD_ADDR: address id=x associated to IP:port [10.1.8.1:999]) ns3::TcpOptionEnd(EOL))
r 0.0162327 /NodeList/4/DeviceList/3/$ns3::PointToPointNetDevice/MacRx ns3::PppHeader (Point-to-Point Protocol: IP (0x0021)) ns3::Ipv4Header (tos 0x0 DSCP Default ECN Not-ECT ttl 64 id 0 protocol 6 offset (bytes) 0 flags [none] length: 60 10.1.6.2 > 10.1.3.4) ns3::TcpHeader (1915 > 12777 [SYN|ACK] Seq=0 Ack=1 Win=2048 ns3::TcpOptionWinScale(0) ns3::TcpOptionMpTcpJoin(MP_JOIN: [SynAck] with nonce=0, HMAC-B=424242) ns3::TcpOptionEnd(EOL))
+ 0.0162327 /NodeList/4/DeviceList/2/$ns3::PointToPointNetDevice/TxQueue/Enqueue ns3::PppHeader (Point-to-Point Protocol: IP (0x0021)) ns3::Ipv4Header (tos 0x0 DSCP Default ECN Not-ECT ttl 63 id 0 protocol 6 offset (bytes) 0 flags [none] length: 60 10.1.6.2 > 10.1.3.4) ns3::TcpHeader (1915 > 12777 [SYN|ACK] Seq=0 Ack=1 Win=2048 ns3::TcpOptionWinScale(0) ns3::TcpOptionMpTcpJoin(MP_JOIN: [SynAck] with nonce=0, HMAC-B=424242) ns3::TcpOptionEnd(EOL))
- 0.0162327 /NodeList/4/DeviceList/2/$ns3::PointToPointNetDevice/TxQueue/Dequeue ns3::PppHeader (Point-to-Point Protocol: IP (0x0021)) ns3::Ipv4Header (tos 0x0 DSCP Default ECN Not-ECT ttl 63 id 0 protocol 6 offset (bytes) 0 flags [none] length: 60 10.1.6.2 > 10.1.3.4) ns3::TcpHeader (1915 > 12777 [SYN|ACK] Seq=0 Ack=1 Win=2048 ns3::TcpOptionWinScale(0) ns3::TcpOptionMpTcpJoin(MP_JOIN: [SynAck] with nonce=0, HMAC-B=424242) ns3::TcpOptionEnd(EOL))
r 0.0162328 /NodeList/5/DeviceList/3/$ns3::PointToPointNetDevice/MacRx ns3::PppHeader (Point-to-Point Protocol: IP (0x0021)) ns3::Ipv4Header (tos 0x0 DSCP Default ECN Not-ECT ttl 64 id 3 protocol 6 offset (bytes) 0 flags [none] length: 72 10.1.8.1 > 10.1.3.4) ns3::TcpHeader (999 > 49153 [ACK] Seq=0 Ack=1000 Win=65535 ns3::TcpOptionMpTcpAddAddress(ADD_ADDR: address id=d associated to IP:port [10.1.6.2:999]) ns3::TcpOptionMpTcpAddAddress(ADD_ADDR: address id=n associated to IP:port [10.1.7.2:999]) ns3::TcpOptionMpTcpAddAddress(ADD_ADDR: address id=x associated to IP:port [10.1.8.1:999]) ns3::TcpOptionEnd(EOL))
+ 0.0162328 /NodeList/5/DeviceList/2/$ns3::PointToPointNetDevice/TxQueue/Enqueue ns3::PppHeader (Point-to-Point Protocol: IP (0x0021)) ns3::Ipv4Header (tos 0x0 DSCP Default ECN Not-ECT ttl 63 id 3 protocol 6 offset (bytes) 0 flags [none] length: 72 10.1.8.1 > 10.1.3.4) ns3::TcpHeader (999 > 49153 [ACK] Seq=0 Ack=1000 Win=65535 ns3::TcpOptionMpTcpAddAddress(ADD_ADDR: address id=d associated to IP:port [10.1.6.2:999]) ns3::TcpOptionMpTcpAddAddress(ADD_ADDR: address id=n associated to IP:port [10.1.7.2:999]) ns3::TcpOptionMpTcpAddAddress(ADD_ADDR: address id=x associated to IP:port [10.1.8.1:999]) ns3::TcpOptionEnd(EOL))
- 0.0162328 /NodeList/5/DeviceList/2/$ns3::PointToPointNetDevice/TxQueue/Dequeue ns3::PppHeader (Point-to-Point Protocol: IP (0x0021)) ns3::Ipv4Header (tos 0x0 DSCP Default ECN Not-ECT ttl 63 id 3 protocol 6 offset (bytes) 0 flags [none] length: 72 10.1.8.1 > 10.1.3.4) ns3::TcpHeader (999 > 49153 [ACK] Seq=0 Ack=1000 Win=65535 ns3::TcpOptionMpTcpAddAddress(ADD_ADDR: address id=d associated to IP:port [10.1.6.2:999]) ns3::TcpOptionMpTcpAddAddress(ADD_ADDR: address id=n associated to IP:port [10.1.7.2:999]) ns3::TcpOptionMpTcpAddAddress(ADD_ADDR: address id=x associated to IP:port [10.1.8.1:999]) ns3::TcpOptionEnd(EOL))
r 0.0164642 /NodeList/3/DeviceList/2/$ns3::PointToPointNetDevice/MacRx ns3::PppHeader (Point-to-Point Protocol: IP (0x0021)) ns3::Ipv4Header (tos 0x0 DSCP Default ECN Not-ECT ttl 63 id 0 protocol 6 offset (bytes) 0 flags [none] length: 56 10.1.3.4 > 10.1.7.2) ns3::TcpHeader (12793 > 48335 [SYN] Seq=0 Ack=0 Win=2048 ns3::TcpOptionWinScale(0) ns3::TcpOptionMpTcpJoin(MP_JOIN: [Syn] with token=887, nonce=887) ns3::TcpOptionEnd(EOL))
+ 0.0164642 /NodeList/3/DeviceList/3/$ns3::PointToPointNetDevice/TxQueue/Enqueue ns3::PppHeader (Point-to-Point Protocol: IP (0x0021)) ns3::Ipv4Header (tos 0x0 DSCP Default ECN Not-ECT ttl 62 id 0 protocol 6 offset (bytes) 0 flags [none] length: 56 10.1.3.4 > 10.1.7.2) ns3::TcpHeader (12793 > 48335 [SYN] Seq=0 Ack=0 Win=2048 ns3::TcpOptionWinScale(0) ns3::TcpOptionMpTcpJoin(MP_JOIN: [Syn] with token=887, nonce=887) ns3::TcpOptionEnd(EOL))
